source,headline,pubdate,headline_length
Yahoo Finance,Prediction: This AI Chip Stock Will Outperform Nvidia Again in 2026 - Yahoo Finance,2026-01-25,83
Nasdaq,OpenAI Stock vs. Anthropic Stock: Which Nvidia-Backed AI Start-up Would Be the Best IPO Stock to Buy in 2026? - Nasdaq,2026-01-25,118
CNBC,Nvidia director Persis Drell resigns with $26 million worth of stock after decade on board - CNBC,2026-01-23,97
Investing.com,Nvidia stock rises after China reportedly clears tech giants to order H200 chips - Investing.com,2026-01-23,96
Mint,"Nvidia director Persis Drell resigns from board, leaves with 1,43,000 shares and stock price gain of 22,000% - Mint",2026-01-25,115
Forbes,"Micron, Nvidia Or Intel Stock: Which Is The Best Bet? - Forbes",2026-01-23,62
Investor's Business Daily,"Dow Jones Futures Fall As Intel Dives, Nvidia Gets H200 China Boost; Tesla Ends Autopilot - Investor's Business Daily",2026-01-23,117
Analytics Insight,NVIDIA Stock Rises After China Signals Progress on H200 AI Chip Imports - Analytics Insight,2026-01-23,91
simplywall.st,Is Fabrinet’s (FN) Nvidia Partnership Quietly Redefining Its Role in the Data Center Stack? - simplywall.st,2026-01-24,107
India.Com,Nvidia board director Presis Drell to get USD 26 million worth of stocks after resignation; know complete det - India.Com,2026-01-24,121
Forbes,Why Nvidia Stock Can Drop 30%? - Forbes,2026-01-21,39
Barron's,Nvidia Stock Falls. ‘The Honeymoon Is Over for AI.’ - Barron's,2026-01-20,62
Yahoo Finance,3 catalysts that could drive Nvidia stock higher in 2026 - Yahoo Finance,2026-01-23,72
Nasdaq,Should Investors Buy Nvidia Stock Before Feb. 25? - Nasdaq,2026-01-23,58
Intellectia AI,"Retail Investors Divest Apple, Shift to Nvidia and Tesla Stocks - Intellectia AI",2026-01-25,80
The Motley Fool,Should Investors Buy Nvidia Stock Before Feb. 25? - The Motley Fool,2026-01-23,67
Trefis,Why NVIDIA Stock Jumped 70%? - Trefis,2026-01-23,37
Barron's,Nvidia Stock Is Lagging Behind Other AI Names. Here's Why. - Barron's,2026-01-22,69
The Motley Fool,"This Super Semiconductor Stock Crushed Nvidia in 2025, and Jan. 28 Could Be a Very Big Day for Its Investors - The Motley Fool",2026-01-21,126
Barron's,Nvidia Stock Gains. Why It Just Got a China Chips Boost. - Barron's,2026-01-23,67
The Motley Fool,Prediction: This Monster Growth Stock Will Soar to $10 Trillion by 2030 - The Motley Fool,2026-01-22,89
Yahoo Finance,"Nvidia (NASDAQ: NVDA) Bull, Base, & Bear Stock Price Prediction and Forecast (Jan 23) - Yahoo Finance",2026-01-23,101
The Motley Fool,What Are the 3 Top Artificial Intelligence (AI) Stocks to Buy Right Now? - The Motley Fool,2026-01-24,90
Investor's Business Daily,"Google, Nvidia, Lilly Lead 5 Stocks Near Buy Points - Investor's Business Daily",2026-01-24,79
The Motley Fool,Prediction: Nvidia Stock Will Be Worth This Much By Year-End 2026 - The Motley Fool,2026-01-20,83
The Motley Fool,The Overlooked AI Chip Stock That Could Outperform Nvidia in 2026 - The Motley Fool,2026-01-20,83
Yahoo Finance,China Poised to Approve Nvidia's H200 Chips for Import. Here's What It Means for Investors - Yahoo Finance,2026-01-24,106
The Motley Fool,2 Monster Stocks to Hold for the Next 5 Years - The Motley Fool,2026-01-23,63
Nasdaq,Palantir Billionaire Peter Thiel Sells Nvidia Stock -- 100% of His Portfolio Is Now Invested in 3 AI Stocks - Nasdaq,2026-01-22,116
CNBC,Nvidia’s Huang to visit China as AI chip sales stall - CNBC,2026-01-23,59
Nasdaq,"If You'd Invested $1,000 in Nvidia 5 Years Ago, Here's How Much You'd Have Today - Nasdaq",2026-01-24,89
Investor's Business Daily,Nvidia Stock Rises With China Set To Allow H200 Chip Orders; Is Nvidia A Buy Now? - Investor's Business Daily,2026-01-23,109
Yahoo Finance,Why Nvidia (NVDA) Stock Is Rising Today - Yahoo Finance,2026-01-23,55
24/7 Wall St.,Will Nvidia Break $300 in 2026 or Should You Buy Broadcom Stock Instead? - 24/7 Wall St.,2026-01-20,88
MarketWatch,Nvidia may have picked up a win in China. So why isn’t the stock surging? - MarketWatch,2026-01-23,87
The Motley Fool,"Prediction: Nvidia Will Overtake Alphabet, Apple, and Microsoft to Become the World's Most Profitable Company by the End of 2027. Here's Why the ""Magnificent Seven"" Stock Is a Buy in January. - The Motley Fool",2026-01-20,209
The Motley Fool,My Top 5 Predictions for Nvidia in 2026 - The Motley Fool,2026-01-11,57
Investor's Business Daily,"Nvidia, IBD Stock Of The Day, Looks To Finally Score China Sales - Investor's Business Daily",2026-01-23,92
MarketBeat,Dock Street Asset Management Inc. Has $215.55 Million Stock Position in NVIDIA Corporation $NVDA - MarketBeat,2026-01-25,109
Nasdaq,Better AI Chip Stock: Nvidia vs. Navitas Semiconductor - Nasdaq,2026-01-21,63
The Motley Fool,Better Artificial Intelligence Stock: Nvidia vs. Meta Platforms - The Motley Fool,2026-01-23,81
Bloomberg,"Stock Movers: Nvidia, Intel, Tesla - Bloomberg",2026-01-23,46
Yahoo Finance,Nvidia Stock Is Rising -- Jensen Hung Says AI Boom Will Create High-Paying Jobs - Yahoo Finance,2026-01-22,95
Bloomberg,Global Chip Stocks Soar as Huang Helps Fuel AI Euphoria at Davos - Bloomberg,2026-01-22,76
Yahoo Finance,Nvidia (NASDAQ: NVDA) Stock Price Prediction for 2026: Where Will It Be in 1 Year (Jan 21) - Yahoo Finance,2026-01-21,106
Yahoo Finance,Nvidia stock retains the crown as 'retail king' despite lagging in 2026 - Yahoo Finance,2026-01-22,87
Bloomberg,"Stock Movers: Intel, Nvidia, Netflix - Bloomberg",2026-01-22,48
Investor's Business Daily,Dow Jones Futures Fall With Trump's Davos Speech Due After Greenland Sell-Off; Netflix Plunges - Investor's Business Daily,2026-01-21,122
The Motley Fool,My Top 3 Chip Stocks for 2025 Crushed the Market. Here's Why They Can Repeat Again in 2026. - The Motley Fool,2026-01-24,109
Value Research,"‘Some Indian IT stocks trade richer than Nvidia, Microsoft’ - Value Research",2026-01-23,76
Benzinga,"Retail Investors Dump Apple Stock While Nvidia, Tesla See Massive Inflows - NVIDIA (NASDAQ:NVDA) - Benzinga",2026-01-25,107
Investing.com India,"Intel, FedEx and JetBlue fall premarket; Nvidia and Booz Allen rise By Investing.com - Investing.com India",2026-01-23,106
Yahoo Finance,Goldman Reaffirms Preference for Nvidia (NVDA) in AI Compute Ecosystem - Yahoo Finance,2026-01-25,86
TechStock²,Nvidia stock rises on China H200 order report before the open — what to watch for NVDA next - TechStock²,2026-01-23,104
The Motley Fool,3 Artificial Intelligence Stocks You Can Buy and Hold for the Next Decade - The Motley Fool,2026-01-22,91
MarketBeat,NVIDIA Corporation $NVDA Stock Holdings Lessened by Essex LLC - MarketBeat,2026-01-25,74
The Motley Fool,3 No-Brainer AI Stocks to Buy Right Now - The Motley Fool,2026-01-24,57
TechStock²,Nvidia stock nudges higher after China trip plan puts AI-chip exports back in play - TechStock²,2026-01-22,95
The Motley Fool,Where Will Nvidia Stock Be in 5 Years? - The Motley Fool,2026-01-14,56
Synopsys,NVIDIA and Synopsys Announce Strategic Partnership to Revolutionize Engineering and Design - Synopsys,2025-12-01,101
Barron's,Nvidia Stock Only Seems to Be Losing Its AI Halo. This Analyst Says It’s Time to Buy. - Barron's,2026-01-16,96
The Motley Fool,2 Quantum Computing Stocks to Buy in Early 2026 - The Motley Fool,2026-01-24,65
Mint,"Intel drags Wall street lower, geopolitical tensions weigh, Nvidia surges 1.4% - Mint",2026-01-23,85
Investor's Business Daily,Nvidia Wavers As Chinese 'AI Tiger' Soars In Trading Debut; Is Nvidia A Buy Now? - Investor's Business Daily,2026-01-09,108
Barron's,Alibaba Stock Jumps. How It Plans to Rival Nvidia on AI Chips. - Barron's,2026-01-22,73
TechStock²,Nvidia stock price: CEO Huang in Shanghai as China H200 decision and Fed week loom - TechStock²,2026-01-24,95
CNBC,"S&P 500 ends Friday little changed, but posts second straight losing week amid wild trading - CNBC",2026-01-23,98
CarbonCredits.com,NVIDIA Stock Rebounds as AI Product Launch and Data Center Demand Restore Confidence - CarbonCredits.com,2025-12-16,104
simplywall.st,China Reopening Tests Nvidia AI Growth Story And Supply Demand Balance - simplywall.st,2026-01-24,86
Barron's,Nvidia Stock Falls. China Chip Sales Are a Big Question. - Barron's,2026-01-08,67
Investing.com South Africa,Nvidia stock rises after China reportedly clears tech giants to order H200 chips By Investing.com - Investing.com South Africa,2026-01-23,126
scanx.trade,"Nvidia Director Persis Drell Resigns from Board with 1,43,000 Shares Worth $26 Million - scanx.trade",2026-01-24,100
Nasdaq,"Nvidia Soared by 39% in 2025, but Here's Another Super Semiconductor Stock to Buy in 2026 - Nasdaq",2026-01-09,98
Yahoo Finance,I Nailed My Nvidia Market Cap Prediction in 2025. Here's Where I Predict It's Going in 2026 (Hint: You're Going to Want to Buy Now) - Yahoo Finance,2026-01-22,147
Yahoo Finance,Where Will Nvidia Stock Be in 1 Year? - Yahoo Finance,2026-01-06,53
Investor's Business Daily,Stock Market Today: Dow Scores Back-To-Back Gains; Spice Maker Plummets (Live Coverage) - Investor's Business Daily,2026-01-22,115
The Motley Fool,This $40 Billion News Could Be Game-Changing for Nvidia Stock in 2026 - The Motley Fool,2026-01-07,87
Barron's,Nvidia Stock Is Stuck. Why It’s Still This Analyst’s Top Pick. - Barron's,2026-01-09,73
NVIDIA Newsroom,NVIDIA Announces Financial Results for Third Quarter Fiscal 2026 - NVIDIA Newsroom,2025-11-19,82
Yahoo Finance,Chip Stocks Are Rising. Nvidia's Huang Reignites the AI Trade - Yahoo Finance,2026-01-22,77
NAI500,"JPMorgan Overhauls AI Stock Picks, Backs Nvidia, Broadcom, and Micron as Top Plays - NAI500",2026-01-23,91
MSN,Nvidia stock rises with China set to allow H200 chip orders; is Nvidia a buy now? - MSN,2026-01-23,87
Yahoo Finance Singapore,NVIDIA Corporation (NVDA) is Attracting Investor Attention: Here is What You Should Know - Yahoo Finance Singapore,2026-01-23,114
Mint,"Intel’s 15% slump drags Wall Street lower, geopolitical tensions weigh, Nvidia surges 1.4% - Mint",2026-01-23,97
The Motley Fool,Prediction: This Company Could Overtake Nvidia as the Largest in the World in 2026 - The Motley Fool,2025-12-31,100
Investor's Business Daily,"Dow Jones Stocks: Nvidia, Amgen Are Near Buy Points But This Longtime Loser Is Winning The Week - Investor's Business Daily",2026-01-23,123
The Motley Fool,Is Nvidia Stock a Buy for 2026? - The Motley Fool,2026-01-10,49
Barchart.com,"As Jensen Huang Preps to Visit China, How Should You Play Nvidia Stock? - Barchart.com",2026-01-22,86
MSN,Nvidia stock is lagging behind other AI names. Why the chips darling is out of favor. - MSN,2026-01-22,91
The Motley Fool,Where Will Nvidia Stock Be in 5 Years? - The Motley Fool,2026-01-09,56
Seeking Alpha,"Intel: Government And Nvidia Backings Not Enough, Shares Materially Overpriced (INTC) - Seeking Alpha",2026-01-23,101
Financial Times,How do you value a company like Nvidia? - Financial Times,2026-01-09,57
CNBC,"Here are Friday's biggest analyst calls: Nvidia, Apple, Wayfair, Nike, Under Armour, CoreWeave & more - CNBC",2026-01-02,108
Investing.com,Micron and Nvidia: The Kings of AI Stocks - Investing.com,2026-01-23,57
Nasdaq,Ready to Buy Nvidia Stock? Check Out This Option. - Nasdaq,2026-01-04,58
TechStock²,NVIDIA stock price rises on China H200 order signal as NVDA heads into a busy week - TechStock²,2026-01-24,95
The Motley Fool,Taiwan Semiconductor Just Delivered Great News for Nvidia Shareholders - The Motley Fool,2026-01-22,88
The Motley Fool,A Once-in-a-Decade Investment Opportunity: The Best Artificial Intelligence (AI) Stock to Buy in 2026 - The Motley Fool,2026-01-12,119
Yahoo Finance,Morning Movers: Nvidia up after report of potential China move on H200 chips - Yahoo Finance,2026-01-24,92
The Motley Fool,4 Top Artificial Intelligence Stocks to Buy Right Now - The Motley Fool,2026-01-22,71
